{
  "schema_version": 1,
  "profile_name": "windfarm_sparse_incidence_group_control_b16_q8192",
  "workflow": "forward",
  "model_family": "honf_forward",
  "case": {
    "id": "WindFarm",
    "config": "project://Case_WindFarm/configs/forward_velocity_b16_q8192.json",
    "dataset_id": "wind_farm_volume_v1"
  },
  "model": {
    "core_honf": {
      "forward_architecture": "sparse_incidence_group_control_honf",
      "interface_model": {
        "message_hidden_dim": 128,
        "attention_heads": 4,
        "relative_fourier_frequencies": 4,
        "receiver_chunk_size": 512,
        "activation_checkpointing": true,
        "group_count": 12,
        "source_normalizer": "entmax15",
        "query_normalizer": "sparsemax",
        "module_temperature": 1.0,
        "environment_temperature": 1.0,
        "query_temperature": 1.0,
        "group_control_dim": 16
      },
      "field_dim": 3,
      "spatial_dim": 3,
      "coordinate_scale": [50.0, 38.0, 6.25],
      "periodic_axes": [],
      "local_context_scale": 0.5,
      "num_env_tokens_x": 16,
      "num_env_tokens_y": 8,
      "hidden_dim": 256,
      "dropout": 0.0,
      "use_layer_norm": true,
      "geometry_mode": "nonperiodic",
      "query_time_mode": "none",
      "query_fourier_frequencies": 4,
      "boundary_feature_mode": "none",
      "position_fourier_frequencies": 4,
      "use_position_fourier_for_modules": true,
      "use_position_fourier_for_env": true,
      "module_radius": 0.5
    }
  },
  "training": {
    "seed": 0,
    "device": "cuda:0",
    "epochs": 5000,
    "learning_rate": 0.0003,
    "organizer_learning_rate": null,
    "weight_decay": 0.00001,
    "amp": false,
    "gradient_clip_norm": 1.0,
    "plot_every_epochs": 10,
    "max_train_batches_per_epoch": null,
    "max_val_batches": null
  },
  "checkpointing": {
    "save_best": true,
    "save_best_field_mse": true,
    "save_best_temperature_mse": false,
    "save_best_predicted": false,
    "save_latest": true,
    "save_latest_every_epochs": 10,
    "save_epoch_milestones": [10, 50, 100, 250, 500, 1000, 1500, 2000, 2500, 5000]
  },
  "run": {
    "id": "2104",
    "name": "windfarm_sparse_incidence_group_control_b16_q8192",
    "output_root": "project://Trained_Results"
  },
  "_note": "Run-1501 sparse-incidence backbone with the Run-2103 WindFarm B16/Q8192/E512 data, optimizer, and tokenization contract; starts from scratch."
}
