{
  "schema_version": 1,
  "profile_name": "windfarm_three_term_full_access",
  "workflow": "forward",
  "model_family": "honf_forward",
  "case": {
    "id": "WindFarm",
    "config": "project://Case_WindFarm/configs/forward_velocity.json",
    "dataset_id": "wind_farm_volume_v1"
  },
  "model": {
    "core_honf": {
      "forward_architecture": "three_term_full_access_honf",
      "interface_model": {
        "message_hidden_dim": 128,
        "attention_heads": 4,
        "coarse_latent_count": 8,
        "coarse_blocks": 1,
        "main_latent_count": 16,
        "main_latent_blocks": 2,
        "local_radius_factor": 2.5,
        "relative_fourier_frequencies": 4,
        "receiver_chunk_size": 128,
        "activation_checkpointing": true
      },
      "field_dim": 3,
      "spatial_dim": 3,
      "coordinate_scale": [50.0, 38.0, 6.25],
      "periodic_axes": [],
      "local_context_scale": 0.5,
      "num_env_tokens_x": 16,
      "num_env_tokens_y": 8,
      "hidden_dim": 256,
      "dropout": 0.0,
      "use_layer_norm": true,
      "geometry_mode": "nonperiodic",
      "query_time_mode": "none",
      "query_fourier_frequencies": 4,
      "boundary_feature_mode": "none",
      "position_fourier_frequencies": 4,
      "use_position_fourier_for_modules": true,
      "use_position_fourier_for_env": true,
      "module_radius": 0.5
    }
  },
  "training": {
    "seed": 0,
    "device": "cuda:0",
    "epochs": 500,
    "learning_rate": 0.0003,
    "organizer_learning_rate": null,
    "weight_decay": 0.00001,
    "amp": false,
    "gradient_clip_norm": 1.0,
    "plot_every_epochs": 25,
    "max_train_batches_per_epoch": 40,
    "max_val_batches": null,
    "init_checkpoint_path": "project://Trained_Results/WindFarm/HONF_Forward_Runs/Run_2103_20260913_135849_windfarm_dense_pairwise_b16_q8192/checkpoints/best_field.pt"
  },
  "checkpointing": {
    "save_best": true,
    "save_best_field_mse": true,
    "save_best_temperature_mse": false,
    "save_best_predicted": false,
    "save_latest": true,
    "save_latest_every_epochs": 10,
    "save_epoch_milestones": [10, 25, 50, 100, 250, 500]
  },
  "run": {
    "id": "2105",
    "name": "windfarm_three_term_full_access_refit",
    "output_root": "project://Trained_Results"
  },
  "_note": "WindFarm W1 refit control. Initializes only compatible dense encoders and fine-reader tensors from the exact Run 2103 manifest-selected e2475 checkpoint; the three-term common head is fresh. The 500-epoch ceiling and 40-batch-per-epoch cap bound this profile to at most 20,000 optimizer updates. Run with CUDA_VISIBLE_DEVICES=2 so cuda:0 maps to physical GPU 2."
}
