{
  "schema_version": 1,
  "profile_name": "phase_shared_group_control_honf",
  "workflow": "forward",
  "model_family": "honf_forward",
  "case": {
    "id": "ThermalChannel",
    "config": "project://Case_ThermalChannel/configs/case_default.json",
    "dataset_id": "thermal_channel_global_v1"
  },
  "model": {
    "core_honf": {
      "forward_architecture": "phase_shared_group_control_honf",
      "interface_model": {
        "message_hidden_dim": 128,
        "attention_heads": 4,
        "relative_fourier_frequencies": 4,
        "receiver_chunk_size": 128,
        "activation_checkpointing": true,
        "group_count": 6,
        "source_normalizer": "entmax15",
        "query_normalizer": "entmax15",
        "module_temperature": 1.0,
        "environment_temperature": 1.0,
        "query_temperature": 1.0,
        "group_control_dim": 16
      },
      "field_dim": "auto",
      "domain_length_x": "auto",
      "domain_length_y": "auto",
      "module_radius": "auto",
      "coordinate_scale": [12.0, 6.0],
      "periodic_axes": [],
      "num_env_tokens_x": 24,
      "num_env_tokens_y": 8,
      "hidden_dim": 256,
      "dropout": 0.0,
      "use_layer_norm": true,
      "geometry_mode": "nonperiodic",
      "query_time_mode": "none",
      "query_fourier_frequencies": 4,
      "boundary_feature_mode": "none",
      "position_fourier_frequencies": 4,
      "use_position_fourier_for_modules": true,
      "use_position_fourier_for_env": true
    }
  },
  "training": {
    "seed": 0,
    "device": "cuda:1",
    "epochs": 50,
    "learning_rate": 0.0003,
    "organizer_learning_rate": null,
    "weight_decay": 0.00001,
    "amp": false,
    "gradient_clip_norm": 1.0,
    "plot_every_epochs": 50,
    "port_curriculum": {
      "schedule": "none",
      "mode": "predicted",
      "mixed_teacher_ratio": 0.0,
      "teacher_epochs": 0,
      "predicted_after_epoch": 0,
      "mixed_teacher_ratio_start": 0.0,
      "mixed_teacher_ratio_end": 0.0
    },
    "max_train_batches_per_epoch": null,
    "max_val_batches": null
  },
  "checkpointing": {
    "save_best": true,
    "save_best_field_mse": true,
    "save_best_temperature_mse": true,
    "save_best_predicted": true,
    "save_latest": true,
    "save_latest_every_epochs": 10,
    "save_epoch_milestones": [10, 50, 100, 250, 500, 1000, 2500, 5000]
  },
  "run": {
    "id": "1407",
    "name": "phase_shared_prototype_group_control",
    "output_root": "project://Trained_Results"
  },
  "_note": "Run 1407 phase-shared K=6/D=16 controller: memberships/control banks are built from contextualized P0 sources once, while fine physical source values and K/V refresh at P1/P2."
}
