{
  "schema_version": 1,
  "profile_name": "converged_identity_preserving_coalescence_honf_context",
  "workflow": "forward",
  "model_family": "honf_forward",
  "case": {
    "id": "ThermalChannel",
    "config": "project://Case_ThermalChannel/configs/case_default.json",
    "dataset_id": "thermal_channel_global_v1"
  },
  "model": {
    "core_honf": {
      "forward_architecture": "converged_identity_preserving_coalescence_honf",
      "interface_model": {
        "message_hidden_dim": 128,
        "attention_heads": 4,
        "relative_fourier_frequencies": 4,
        "receiver_chunk_size": 128,
        "activation_checkpointing": true,
        "group_count": 12,
        "source_normalizer": "entmax15",
        "query_normalizer": "sparsemax",
        "module_temperature": 1.0,
        "environment_temperature": 1.0,
        "query_temperature": 1.0,
        "group_control_dim": 16,
        "environment_refinement_normalizer": "sparsemax",
        "fusion_max_iterations": 512,
        "fusion_eta_final": 0.5,
        "fusion_ramp_epochs": 150,
        "fusion_eps_abs": 1e-9,
        "fusion_eps_rel": 1e-8
      },
      "field_dim": "auto",
      "domain_length_x": "auto",
      "domain_length_y": "auto",
      "module_radius": "auto",
      "coordinate_scale": [
        12.0,
        6.0
      ],
      "periodic_axes": [],
      "num_env_tokens_x": 24,
      "num_env_tokens_y": 8,
      "hidden_dim": 256,
      "dropout": 0.0,
      "use_layer_norm": true,
      "geometry_mode": "nonperiodic",
      "query_time_mode": "none",
      "query_fourier_frequencies": 4,
      "boundary_feature_mode": "none",
      "position_fourier_frequencies": 4,
      "use_position_fourier_for_modules": true,
      "use_position_fourier_for_env": true
    }
  },
  "training": {
    "seed": 0,
    "device": "cuda:2",
    "epochs": 500,
    "learning_rate": 0.0003,
    "organizer_learning_rate": null,
    "weight_decay": 1e-05,
    "amp": false,
    "gradient_clip_norm": 1.0,
    "plot_every_epochs": 50,
    "port_curriculum": {
      "schedule": "none",
      "mode": "predicted",
      "mixed_teacher_ratio": 0.0,
      "teacher_epochs": 0,
      "predicted_after_epoch": 0,
      "mixed_teacher_ratio_start": 0.0,
      "mixed_teacher_ratio_end": 0.0
    },
    "max_train_batches_per_epoch": null,
    "max_val_batches": null
  },
  "checkpointing": {
    "save_best": true,
    "save_best_field_mse": true,
    "save_best_temperature_mse": true,
    "save_best_predicted": true,
    "save_latest": true,
    "save_latest_every_epochs": 10,
    "save_epoch_milestones": [
      10,
      50,
      150,
      500
    ]
  },
  "run": {
    "id": "1505",
    "name": "1503_v3_converged_identity_preserving_coalescence",
    "output_root": "project://Trained_Results"
  },
  "_note": "Run 1503-v3: Run 1502 scientific base with converged reversible, identity-preserving coalescence; K=12, D=16, sparsemax environmental refinement, eta=0.5 ramped over 150 epochs, fixed 512-step solver ceiling. Fresh training; no warm start."
}
